Title,ParentID,CollaborationPeriod,Entity,DescriptionENG,DescriptionSPA,DirectResultsENG,DirectResultsSPA
NSA-2025-39-A_9,39,,PAHO/OPS & NSA/ANE,"In April 2025, UNITE, with the support of PAHO, contributed to the establishment of the Diplomats for Health Front in Bolivia — a regional, innovative initiative led by Hon. Cláudio Marte, UNITE member and Ambassador of the Dominican Republic to Bolivia. This experience seeks to inspire similar initiatives in other countries across the Americas.","En abril de 2025, UNITE, con el apoyo de la OPS, contribuyó al establecimiento del Frente de Diplomáticos para la Salud en Bolivia, una iniciativa regional e innovadora liderada por el Hon. Cláudio Marte, miembro de UNITE y Embajador de la República Dominicana en Bolivia. Esta experiencia busca inspirar iniciativas similares en otros países de las Américas.","This initiative reflects a growing recognition of the role of diplomatic engagement in addressing health challenges, promoting research, and fostering international cooperation with PAHO and WHO. By uniting efforts across sectors, it contributes to strengthening global health systems and reducing health inequalities, and may serve as a model for similar efforts in other countries in the region.","- Esta iniciativa refleja un reconocimiento creciente del papel del compromiso diplomático para abordar los desafíos de salud, promover la investigación y fomentar la cooperación internacional con la OPS y la OMS.  
- Al unir esfuerzos entre sectores, contribuye a fortalecer los sistemas de salud globales y reducir las desigualdades en salud, y puede servir como un modelo para esfuerzos similares en otros países de la región."
NSA-2025-39-A_10,39,,NSA/ANE,"In 2023, UNITE launched the “Join Your Delegation” Campaign (JYD), a recurring initiative aimed at encouraging its members to participate in high-level global health forums, such as the World Health Assembly (WHA) and the United Nations General Assembly (UNGA), by formally requesting to be included in their national delegations through their respective Parliaments and Governments.","En 2023, UNITE lanzó la Campaña “Únete a tu Delegación” (JYD), una iniciativa recurrente diseñada para alentar a sus miembros a participar en foros globales de salud de alto nivel, como la Asamblea Mundial de la Salud (AMS) y la Asamblea General de las Naciones Unidas (AGNU), solicitando formalmente su inclusión en las delegaciones nacionales a través de sus respectivos Parlamentos y Gobiernos.","- UNITE developed a campaign briefing and a letter template addressed to Ministers of Health, which parliamentarians could use to support their formal request to join national delegations to WHA76.
- Promotional materials were created for use on personal social media channels, encouraging other parliamentarians to join the campaign and amplify its visibility.
- All materials were shared with UNITE members and published on the dedicated JYD webpage, making them accessible to partners, interested stakeholders, and the general public.","- UNITE desarrolló un informe de campaña y una plantilla de carta dirigida a los Ministros de Salud, que los parlamentarios podrían utilizar para apoyar su solicitud formal de unirse a las delegaciones nacionales en la WHA76.  
- Se crearon materiales promocionales para su uso en los canales de redes sociales personales, animando a otros parlamentarios a unirse a la campaña y amplificar su visibilidad.  
- Todos los materiales se compartieron con los miembros de UNITE y se publicaron en la página web dedicada de JYD, haciéndolos accesibles a socios, partes interesadas y al público en general."
NSA-2025-39-A_11,39,,PAHO/OPS & NSA/ANE,"On September 23rd, 2025, PAHO and UNITE, on the sidelines of UNGA 80 in New York, signed a Memorandum of Understanding aimed at supporting lawmakers in shaping public health policy through informed debate, evidence-based decision-making, and greater alignment with international health standards and priorities.","El 23 de septiembre de 2025, la OPS y UNITE, al margen de la 80ª Asamblea General de la ONU en Nueva York, firmaron un Memorando de Entendimiento destinado a apoyar a los legisladores en la formulación de políticas de salud pública a través de un debate informado, la toma de decisiones basada en evidencia y una mayor alineación con los estándares y prioridades internacionales de salud.","Through the Framework Agreement, both organizations committed to organizing joint initiatives such as technical webinars, workshops, and high-level events focused on strengthening legislative responses to public health challenges. Topics may include health financing, universal health coverage, pandemic preparedness, noncommunicable diseases, and the social and environmental determinants of health.

PAHO will continue to provide technical assistance and share guidance and data to support parliamentarians in shaping policy aligned with regional and global health goals. UNITE will engage its extensive network of parliamentarians to promote knowledge sharing, identify legislative gaps, and foster political will around health reforms.","A través del Acuerdo Marco, ambas organizaciones se comprometieron a organizar iniciativas conjuntas como seminarios web técnicos, talleres y eventos de alto nivel enfocados en fortalecer las respuestas legislativas a los desafíos de salud pública. Los temas pueden incluir financiamiento de la salud, cobertura de salud universal, preparación para pandemias, enfermedades no transmisibles y los determinantes sociales y ambientales de la salud.

La OPS continuará brindando asistencia técnica y compartiendo orientación y datos para apoyar a los parlamentarios en la formulación de políticas alineadas con los objetivos de salud regionales y globales. UNITE involucrará su amplia red de parlamentarios para promover el intercambio de conocimientos, identificar brechas legislativas y fomentar la voluntad política en torno a las reformas de salud."
NSA-2025-39-A_12,39,,PAHO/OPS & NSA/ANE,"Since 2022, UNITE and PAHO have collaborated in the Region through sustained parliamentary engagement on health legislation and governance. This includes consultations on priorities, joint agenda-setting, and PAHO’s technical participation in dialogues and policy discussions organized by UNITE Americas Chapter. Activities support PAHO’s cooperation on health law and governance and have informed legislative debates on digital health, pandemic preparedness, AMR, health financing, and mental health.","Desde 2022, UNITE y la OPS han colaborado en la Región a través de un compromiso parlamentario sostenido en la legislación y gobernanza de la salud. Esto incluye consultas sobre prioridades, establecimiento conjunto de agendas y la participación técnica de la OPS en diálogos y discusiones políticas organizadas por el Capítulo de UNITE América. Las actividades apoyan la cooperación de la OPS en derecho y gobernanza de la salud y han informado los debates legislativos sobre salud digital, preparación para pandemias, resistencia a los antimicrobianos (RAM), financiamiento de la salud y salud mental.","- Strengthened parliamentary capacity to engage with PAHO technical cooperation on health legislation and governance.
- Expanded PAHO’s engagement with legislative actors as part of its multisectoral approach under the Sustainable Health Agenda for the Americas.
- Facilitated regional exchange of legislative experiences and best practices, contributing to more coherent and informed health policymaking.","– Fortalecida la capacidad parlamentaria para interactuar con la cooperación técnica de la OPS en legislación y gobernanza en salud.  
– Ampliada la participación de la OPS con actores legislativos como parte de su enfoque multisectorial bajo la Agenda de Salud Sostenible para las Américas.  
– Facilitado el intercambio regional de experiencias legislativas y mejores prácticas, contribuyendo a una formulación de políticas de salud más coherente e informada."
NSA-2025-38-A_1,38,,PAHO/OPS & NSA/ANE,"Consolidation of preparatory work for the virtual course on sexual health for first-level healthcare professionals. Throughout 2024, an Advisory Group made up of international experts affiliated with WAS and professionals from PAHO/WHO reviewed, agreed upon, and approved the format, objectives, and content of the modules through virtual meetings. The Group continues to oversee the subsequent stages leading to full implementation.","Consolidación del trabajo preparatorio para el curso virtual sobre salud sexual para profesionales de la salud en el primer nivel de atención. Durante 2024, un Grupo Asesor compuesto por expertos internacionales afiliados a la WAS y profesionales de la OPS/OMS revisó, acordó y aprobó el formato, los objetivos y el contenido de los módulos a través de reuniones virtuales. El Grupo continúa supervisando las etapas posteriores que conducen a la implementación completa.","- Progress and the evidence of Systematic Reviews were presented at a joint symposium during the XXII Latin American Congress of Sexology and Sexual Education, ""CLASES 2024"" in Lima, Peru. 
- On World Sexual Health Day, September 4, 2025, PAHO and WAS launched the virtual course ""Sexual Health for Professionals at the First Level of Care,"" available on PAHO's Virtual Campus for Public Health. In the first month after launching the course, 1,800 participants registered on the virtual campus in Spanish.
- Conceptual contribution to the Global Sexual Health Observatory at the University of Porto in Portugal.","- Se presentaron los avances y la evidencia de las Revisiones Sistemáticas en un simposio conjunto durante el XXII Congreso Latinoamericano de Sexología y Educación Sexual, ""CLASES 2024"" en Lima, Perú.  
- En el Día Mundial de la Salud Sexual, el 4 de septiembre de 2025, la OPS y la WAS lanzaron el curso virtual ""Salud Sexual para Profesionales del Primer Nivel de Atención"", disponible en el Campus Virtual de Salud Pública de la OPS. Solo en el primer mes después del lanzamiento del curso, 1.800 participantes se registraron en el campus virtual en español.  
- Contribución conceptual al Observatorio Global de Salud Sexual en la Universidad de Oporto en Portugal."
NSA-2025-35-A_1,35,,PAHO/OPS,"MOD participated in a virtual meeting (Sick & Small Newborns, October 31, 2024) organized by PAHO/WHO to advocate for the rights of children born prematurely, as well as those of their families. MOD presented on the importance of the family voice and family-centered care for families who have a baby in the NICU, drawing on institutional expertise. Representatives from parent groups of preterm babies from ten countries across the Americas were supported.","MOD participó en una reunión virtual (Recién nacidos enfermos y pequeños, 31 de octubre de 2024) organizada por la OPS/OMS para abogar por los derechos de los niños nacidos prematuramente, así como por los de sus familias. MOD presentó sobre la importancia de la voz de la familia y la atención centrada en la familia para las familias que tienen un bebé en la UCI neonatal, basándose en la experiencia institucional. Se brindó apoyo a representantes de grupos de padres de bebés prematuros de diez países de las Américas.",Groups of preterm families from ten priority countries in Latin America and the Caribbean shared their experiences and enhanced their knowledge and skills in communication as a means of strengthening awareness and family participation in providing care for small and sick newborns.,Grupos de familias de recién nacidos prematuros de diez países prioritarios de América Latina y el Caribe compartieron su experiencia y mejoraron su conocimiento y habilidades en comunicación como medio para fortalecer la concienciación y la participación de las familias en la atención de recién nacidos pequeños y enfermos.
NSA-2025-35-A_2,35,,PAHO/OPS,"MOD participated in a webinar coordinated by PAHO: Challenges and Perspectives of Families in Providing Care to Newborns with Cardiac Heart Disease. (August 27, 2024) MOD presented on ""Shaping Policy for Change: Incorporating Family Perspectives."" The MOD policy team discussed the role of civil society in shaping policy, advocating for newborn screening, and incorporating the voices of families in policymaking.","MOD participó en un seminario web coordinado por la OPS: Desafíos y perspectivas de las familias en la atención a recién nacidos con enfermedades cardíacas. (27 de agosto de 2024) MOD presentó sobre ""Dando forma a la política para el cambio: incorporando las perspectivas familiares"". El equipo de políticas de MOD habló sobre el papel de la sociedad civil en la formulación de políticas y sobre la defensa de la detección temprana en recién nacidos, así como la incorporación de la voz de la familia en la toma de decisiones políticas.","Increased awareness of the need to include the perspectives of families in the planning of policies and advocating for them. More than 700 participants, including families and organizations from civil society, attended the meeting.","Aumento de la conciencia sobre la necesidad de incluir las perspectivas de las familias en la planificación de políticas y en la defensa de las mismas. Más de 700 participantes, incluidas familias y organizaciones de la sociedad civil, asistieron a la reunión."
NSA-2025-35-A_3,35,,PAHO/OPS & NSA/ANE,"MOD co-led the organization of the 10th International Conference on Birth Defects, which focused on the theme: Accelerating Action for Birth Defects and Disabilities: Surveillance, Prevention, Screening, Management, and Family-Centered Care. The conference was held in Chile from March 1-4, 2023. MOD, along with PAHO, WHO, CDC, and scientific and academic institutions such as the International Clearinghouse for Birth Defects Surveillance and Research, co-organized and led the conference.","MOD co-lideró la organización de la 10ª Conferencia Internacional sobre Defectos de Nacimiento, centrada en el tema: Acelerando la Acción para los Defectos de Nacimiento y Discapacidades: Vigilancia, Prevención, Detección, Manejo y Atención Centrada en la Familia, que se llevó a cabo en Chile del 1 al 4 de marzo de 2023. MOD, junto con la OPS, la OMS, los CDC y las instituciones científicas y académicas como el Centro Internacional de Información sobre Vigilancia e Investigación de Defectos de Nacimiento, co-organizó y lideró la Conferencia.","The conference had 220 registered participants, with 189 in attendance. Participants included representatives from 25 countries, listed in alphabetical order: Argentina, Australia, Bangladesh, Bolivia, Botswana, Brazil, Chile, Colombia, Costa Rica, England, India, Kenya, Malawi, Namibia, Nepal, Nicaragua, Pakistan, Paraguay, Philippines, South Africa, Sri Lanka, Switzerland, Uganda, the United States, and Uruguay. 

Over the four-day conference, there were six plenary sessions and 114 presentations covering topics such as screening, surveillance, prevention, management and care, and parent engagement. Additionally, there were 84 posters showcasing a variety of topics and findings. A pre-conference workshop focused on surveillance was conducted by the CDC and WHO, with 32 participants.

As a next step from ICBD2023, participants agreed to initiate a Call to Action regarding the integration, prevention, screening, diagnosis, and management of birth defects and disabilities into routine health services.","La conferencia tuvo 220 participantes registrados, de los cuales 189 asistieron. Los participantes incluyeron representación de 25 países, incluyendo (en orden alfabético) Argentina, Australia, Bangladés, Bolivia, Botsuana, Brasil, Chile, Colombia, Costa Rica, Inglaterra, India, Kenia, Malaui, Namibia, Nepal, Nicaragua, Pakistán, Paraguay, Filipinas, Sudáfrica, Sri Lanka, Suiza, Uganda, Estados Unidos y Uruguay. 

Durante la conferencia de cuatro días, se llevaron a cabo seis sesiones plenarias y 114 presentaciones que abarcaron temas de detección, vigilancia, prevención, manejo y atención, así como la participación de los padres. También hubo 84 carteles que presentaron una variedad de temas y hallazgos. Un taller previo a la conferencia centrado en la vigilancia fue dirigido por los CDC y la OMS con 32 participantes.

Como siguiente paso de ICBD2023, los participantes se alinearon para iniciar un Llamado a la Acción respecto a la integración, prevención, detección, diagnóstico y manejo de los defectos de nacimiento y la discapacidad en los servicios de salud rutinarios."
NSA-2025-35-A_4,35,,PAHO/OPS,"PAHO organized a webinar in commemoration of World Patient Safety Day (WPSD) on September 23, 2025, with the theme ""Safe care for every newborn and every child."" MOD contributed by presenting the experience of family and caregiver involvement in the quality and safety of newborn care. MOD also advocated for the role of families and caregivers in improving the quality of care, which depends not only on healthcare teams but also on their caregivers.","La OPS organizó un seminario web en conmemoración del Día Mundial de la Seguridad del Paciente (WPSD), el 23 de septiembre de 2025, con el tema ""Cuidado seguro para cada recién nacido y cada niño"". MOD contribuyó presentando la experiencia en la participación de familias y cuidadores en la calidad y seguridad del cuidado de los recién nacidos. MOD también abogó por el papel de las familias y cuidadores en la mejora de la calidad del cuidado, que depende no solo de los equipos de salud, sino también de sus cuidadores.","Over 3,000 registrants and more than 1,000 who actively participated until the end.","Más de 3,000 registrados y más de 1,000 que participaron activamente hasta el final."
NSA-2025-29-A_1,29,,NSA/ANE,"Mobilization of the IDF network to advocate with national Ministries of Health for the inclusion of the HEARTS package D-module on diagnosis and management of type 2 diabetes in national programs, promotion of the use of the PAHO Strategic Fund, and dissemination of global initiatives such as Better Care for NCDs, the Global Diabetes Compact, and the diabetes coverage targets.","Movilización de la red de las FDI para abogar ante los Ministerios de Salud nacionales por la inclusión del módulo D del paquete HEARTS sobre diagnóstico y manejo de la diabetes tipo 2 en los programas nacionales, promoción del uso del Fondo Estratégico de la OPS y difusión de iniciativas globales como Mejor Atención para las ENCD, el Pacto Global sobre Diabetes y los objetivos de cobertura de la diabetes.","-A leaflet (in English and Spanish) was created to support advocacy efforts by the IDF network with national Ministries of Health, outlining the HEARTS package D-module, Better Care for NCDs, the Global Diabetes Compact, diabetes coverage targets, and the PAHO Strategic Fund.

-A Webinar (in English and Spanish) was held for IDF members to present the leaflet and offer guidance on its use, with participation from the PAHO focal point.","- Se desarrolló un folleto (en inglés y español) para apoyar los esfuerzos de defensa de la red de la IDF con los Ministerios de Salud nacionales, describiendo el módulo D del paquete HEARTS, Mejor Atención para las ENTs, el Compromiso Global sobre la Diabetes, los objetivos de cobertura de diabetes y el Fondo Estratégico de la OPS.

- Se llevó a cabo un seminario web (en inglés y español) para los miembros de la IDF con el fin de presentar el folleto y proporcionar orientación sobre su uso, con la participación del punto focal de la OPS."
NSA-2025-29-A_2,29,,PAHO/OPS & NSA/ANE,"Collaboration between IDF and PAHO to cross-promote educational materials and activities related to diabetes, including the dissemination of public education resources, joint participation in online events, and joint visibility efforts such as the World Diabetes Day campaign.","Colaboración entre la IDF y la OPS para promover de manera cruzada materiales educativos y actividades relacionadas con la diabetes, incluyendo la difusión de recursos de educación pública, la participación conjunta en eventos en línea y esfuerzos conjuntos de visibilidad, como la campaña del Día Mundial de la Diabetes.","- Monthly calls with the focal point for a continuous exchange of information between IDF and PAHO about ongoing activities.
- Cross-promotion of World Diabetes Day and relevant international days messaging.
- IDF and its North America and Caribbean and South and Central American Regions shared relevant PAHO social media posts with its network (notably on Better Care on NCDs and HEARTS-D) to promote the work of the entity.","- Llamadas mensuales con el punto focal para un intercambio continuo de información entre la IDF y la OPS sobre las actividades en curso.  
- Promoción cruzada del Día Mundial de la Diabetes y mensajes de días internacionales relevantes.  
- La IDF y sus Regiones de América del Norte y el Caribe, así como de América del Sur y Central, compartieron publicaciones relevantes de la OPS en redes sociales con su red (notablemente sobre Mejor Atención en las ENTs y HEARTS-D), para promover el trabajo de la entidad."
NSA-2025-29-A_3,29,,NSA/ANE,"Development of infographics for healthcare professionals and individuals living with diabetes, focusing on diabetes-related complications and the prevention of type 2 diabetes, aimed at the general public.","Desarrollo de infografías para profesionales de la salud y personas que viven con diabetes, centradas en las complicaciones relacionadas con la diabetes y la prevención de la diabetes tipo 2, dirigidas al público en general.","- This activity was not included in the original plan, but it was agreed to replace the awareness-raising webinar that could not be developed.  
- The infographics began development in September 2025 and will be ready in early 2026. They will focus on raising awareness of diabetes complications for healthcare professionals and individuals living with or at risk of diabetes.  
- The plan has been discussed with our focal point, who will receive the drafts for input as soon as they are ready.","- Esta actividad no estaba incluida en el plan original, pero se acordó reemplazar el seminario web de sensibilización que no pudo desarrollarse.  
- Las infografías comenzaron a desarrollarse en septiembre de 2025 y estarán listas a principios de 2026. Se centrarán en la concienciación sobre las complicaciones de la diabetes para profesionales de la salud y personas que viven con diabetes o que están en riesgo de padecerla.  
- El plan ha sido discutido con nuestro punto focal, quien recibirá los borradores para su revisión tan pronto como estén listos."
NSA-2025-27-A_1,27,,NSA/ANE,"USP worked closely with PAHO on activities to enhance access to quality and safe medicines, helping to improve the health of people in Latin America and the Caribbean. Building on previous accomplishments, USP collaborated with PAHO to further strengthen the regional regulatory capacities to respond to the challenges of ensuring the availability of quality-assured products.","USP trabajó en estrecha colaboración con la OPS en actividades para mejorar el acceso a medicamentos de calidad y seguros, ayudando a mejorar la salud de las personas en América Latina y el Caribe. Basándose en logros anteriores, USP colaboró con la OPS para fortalecer aún más las capacidades regulatorias regionales para responder a los desafíos de garantizar la disponibilidad de productos con garantía de calidad.","USP and PAHO together helped enhance regional capacity to ensure the quality of medicines and other health technologies available to patients and consumers. Improved quality management systems in regulatory and laboratory settings, in alignment with internationally recognized standards, can effectively support the regulatory system within the country and/or in sub-regional initiatives.","USP y la OPS juntos ayudaron a mejorar la capacidad regional para garantizar la calidad de los medicamentos y otras tecnologías de salud disponibles para pacientes y consumidores. Se mejoraron los sistemas de gestión de calidad en entornos regulatorios y de laboratorio, en alineación con estándares internacionalmente reconocidos, que pueden apoyar de manera efectiva el sistema regulatorio dentro del país y/o en iniciativas subregionales."
