Title,ParentID,CollaborationPeriod,Entity,DescriptionENG,DescriptionSPA,DirectResultsENG,DirectResultsSPA
NSA-2025-51-A_3,51,,PAHO/OPS & NSA/ANE,"1) Engagement in the coordination and planning of activities related to National Public Health Week, World Health Day, and Wellness Week; 2) Supporting the development of the Alliance of Public Health Associations of the Americas (APHAA/AASPA); and 3) Coordinated communications to share opportunities and resources through the organizations’ networks.","1) Participación en la coordinación y planificación de actividades relacionadas con la Semana Nacional de la Salud Pública, el Día Mundial de la Salud y la Semana del Bienestar; 2) Apoyo al desarrollo de la Alianza de Asociaciones de Salud Pública de las Américas (APHAA/AASPA); y 3) Comunicaciones coordinadas para compartir oportunidades y recursos a través de las redes de las organizaciones.","The results of these activities increased awareness of public health issues to inspire action and change among US stakeholders and the general public. By identifying opportunities to share experiences, communicate, and coordinate activities related to National Public Health Week, World Health Day, and Wellness Week, they have contributed to enhancing the value of these annual public health initiatives held throughout the year, along with partner activities and initiatives.","Los resultados de estas actividades concientizaron sobre los problemas de salud pública para inspirar acción/cambio entre los interesados en EE. UU. y el público en general. Al encontrar oportunidades para compartir experiencias, comunicaciones y la coordinación de actividades relacionadas con la Semana Nacional de la Salud Pública, el Día Mundial de la Salud y la Semana del Bienestar, han ayudado a aumentar el valor de estas iniciativas anuales de salud pública que se llevan a cabo a lo largo del año junto con actividades/iniciativas de socios."
NSA-2025-47-A_1,47,,NSA/ANE,"• I work on cross-cutting issues related to climate change, resilience, and their impacts on the water and sanitation sector, as well as on people's health.  
• Expansion of thematic activities through forums and working groups with strategic allies and regional experts, to generate technical documents, guides, and other valuable resources.","• I work on cross-cutting issues related to climate change, resilience, and their impacts on the water and sanitation sector, as well as on people's health.  
• Expansion of thematic activities through forums and working groups with strategic allies and regional references, to generate technical documents, guides, and other valuable inputs.","Consolidation of the technical link between local governments and AIDIS with the support of PAHO, to promote activities related to water, sanitation, hygiene, climate change, risk management, and air quality. -Completion of the GLASS form and technical tables, workshops, virtual and in-person meetings to review and socialize the progress of countries in meeting the SDGs in the LAC region. Support in the preparation of progress reports on the SDGs, focused on collaborative work lines with PAHO, in the LAC countries, and support for the water, sanitation, and hygiene sector, climate change, air quality, and risk management of local governments.","Consolidación del enlace técnico entre los gobiernos locales y AIDIS con el apoyo de OPS, para impulsar actividades relacionadas con agua, saneamiento, higiene, cambio climático, gestión de riesgo y calidad del aire. - Llenado de formulario GLASS y mesas técnicas, talleres, encuentros virtuales y presenciales para revisar y socializar los avances de los países en el cumplimiento de los ODS de la región de ALC. Apoyo en la elaboración de los informes de avances de los ODS, orientados a las líneas de trabajo colaborativas con OPS, en los países de ALC y apoyo al sector de agua, saneamiento e higiene, cambio climático, aire y gestión de riesgo de los gobiernos locales."
NSA-2025-47-A_2,47,,NSA/ANE,"Diagnostics of the status of water and sanitation systems in health facilities (hospitals in capital and intermediate cities).  
Support in the rehabilitation of water and sanitation services in post-emergency contexts.",Diagnósticos del estado de los sistemas de agua y saneamiento en establecimientos de salud (hospitales de ciudades capitales e intermedias). Apoyo en la rehabilitación de servicios de agua y saneamiento en contextos post-emergencia.,"Technical Advisory on the situation of water, sanitation, and hygiene in Health Facilities of ALC, applying ETRAS/OPS protocols.

Report on water, sanitation, and hygiene in health facilities of the 6 selected countries.","Asesoría Técnica sobre la situación de agua, saneamiento e higiene en Establecimientos de Salud de ALC, aplicando protocolos de ETRAS/OPS.

Reporte sobre agua, saneamiento e higiene en los establecimientos de salud de los 6 países seleccionados."
NSA-2025-47-A_3,47,,PAHO/OPS & NSA/ANE,"Joint activities (AIDIS-OPS) for the promotion and commemoration of international days to build environmentally responsible and resilient communities, considering the environmental determinants of health.","Actividades conjuntas (AIDIS-OPS) de promoción y conmemoración de los días internacionales para construir comunidades ambientalmente responsables y resilientes, considerando los determinantes ambientales de la salud.","Joint organization of activities (webinars, workshops) to commemorate international days, such as:
Inter-American Day of Air Quality
Inter-American Day of Water
Inter-American Day of Sanitation","Organización conjunta de actividades (seminarios web, talleres) para conmemorar los días internacionales, como:
Día Interamericano de la Calidad del Aire
Día Interamericano del Agua 
Día Interamericano del Saneamiento"
NSA-2025-46-A_1,46,,PAHO/OPS & NSA/ANE,,,,
NSA-2025-46-A_2,46,,PAHO/OPS & NSA/ANE,,,,
NSA-2025-46-A_3,46,,PAHO/OPS & NSA/ANE,,,,
NSA-2025-46-A_4,46,,PAHO/OPS & NSA/ANE,,,,
NSA-2025-46-A_5,46,,NSA/ANE,,,,
NSA-2025-46-A_6,46,,NSA/ANE,,,,
NSA-2025-39-A_1,39,,NSA/ANE,"In April 2024, UNITE and PAHO jointly contributed to a high-level parliamentary policy dialogue held during the World Bank and International Monetary Fund Spring Meetings on ‘Health is Wealth - Parliamentarians as Key Players in Health Financing.’ The activity advanced collaboration to strengthen parliamentary engagement on sustainable health financing and pandemic preparedness and response. PAHO provided technical insights on pandemic preparedness and response financing and reinforced parliamentarians’ role in aligning budgets with regional health priorities.","En abril de 2024, UNITE y la OPS contribuyeron conjuntamente a un diálogo político parlamentario de alto nivel celebrado durante las Reuniones de Primavera del BM y el FMI sobre ""La salud es riqueza: los parlamentarios como actores clave en la financiación de la salud"". La actividad promovió la colaboración para fortalecer el compromiso parlamentario en la financiación sostenible de la salud y la preparación y respuesta ante pandemias. La OPS proporcionó conocimientos técnicos sobre la financiación de la preparación y respuesta (PPR) y reforzó el papel de los parlamentarios en la alineación de los presupuestos con las prioridades de salud regionales.","- Parliamentarians from all over the world gained a better understanding of the societal relevance of health, the economic pressures on healthcare systems, and the need for countries to actively engage at both national and international levels.
- Highlighted parliamentarians’ role in addressing financial constraints and engaging at national and international levels, and identified UNITE’s IFGH as a key connector for national and international budgetary issues and a supporter of 11 sustainable health investments in health.
- Raised awareness among parliamentarians on the importance of an agreement on pandemic prevention and the opportunities for their involvement in its discussions.","- Los parlamentarios de todo el mundo adquirieron una mejor comprensión de la relevancia social de la salud, las presiones económicas sobre los sistemas de salud y la necesidad de que los países se involucren activamente tanto a nivel nacional como internacional.
- Se destacó el papel de los parlamentarios en la atención a las limitaciones financieras y en el compromiso a niveles nacional e internacional, y se identificó el IFGH de UNITE como un conector clave para los problemas presupuestarios nacionales e internacionales y un defensor de 11 inversiones sostenibles en salud.
- Se concienció a los parlamentarios sobre la importancia de un acuerdo sobre la prevención de pandemias y las oportunidades para su participación en las discusiones al respecto."
NSA-2025-39-A_2,39,,PAHO/OPS & NSA/ANE,"In March 2024, UNITE, in collaboration with PAHO, held a regional parliamentary dialogue for Latin America and the Caribbean under the ‘Let’s Talk Health’ initiative, focusing on antimicrobial resistance (AMR). This activity was part of organized regional engagements where PAHO offers technical input, regional evidence, and policy guidance to inform parliamentary discussions on priority health issues. PAHO contributed through its AMR Special Program, supporting evidence-based dialogue on legislation, budgeting, and implementation challenges in the region.","En marzo de 2024, UNITE, en conjunto con la OPS, llevó a cabo un diálogo parlamentario regional para América Latina y el Caribe bajo la iniciativa 'Hablemos de Salud', centrado en la RAM. La actividad fue parte de compromisos regionales estructurados donde la OPS proporciona insumos técnicos, evidencia regional y orientación política para informar las discusiones parlamentarias sobre temas de salud prioritarios. La OPS contribuyó a través de su Programa Especial de RAM, apoyando un diálogo basado en evidencia sobre legislación, presupuestos y desafíos de implementación en la Región.","As part of its ""Let's Talk Health"" initiative—a series of dedicated regional sessions focused on relevant global health priorities—UNITE provided parliamentarians from Latin America and the Caribbean with a platform to share best practices, achievements, and challenges related to AMR legislation, budgeting, and implementation. The exchange of experiences regarding policy, budgeting, and implementation offered valuable insights that will help inform future legislative proposals. PAHO provided the latest evidence-based data on AMR, giving parliamentarians a regional perspective. This strengthened the capacity of parliamentarians to integrate PAHO's technical guidance into national AMR legislative and oversight processes.","- Como parte de su iniciativa ""Hablemos de Salud"" - un conjunto de sesiones regionales dedicadas a prioridades globales de salud relevantes, UNITE proporcionó a los parlamentarios de América Latina y el Caribe una plataforma para compartir mejores prácticas, logros y desafíos relacionados con la legislación, el presupuesto y la implementación sobre RAM.
- El intercambio de experiencias—sobre políticas, presupuestos e implementación—ofreció valiosos conocimientos que ayudan a informar futuras propuestas legislativas.
- La OPS proporcionó los últimos datos basados en evidencia sobre RAM, brindando a los parlamentarios un panorama regional.
- Se fortaleció la capacidad de los parlamentarios para integrar la orientación técnica de la OPS en los procesos legislativos y de supervisión nacionales sobre RAM."
NSA-2025-39-A_3,39,,PAHO/OPS & NSA/ANE,"In September 2023, UNITE PAHO and the ""Health Observatory of the University of Buenos Aires"" co-hosted a roundtable titled ""The Future of the Parliamentary Agenda on Digital Health."" The event aimed to foster dialogue on the digital transformation of health and explore strategies for building effective digital health governance mechanisms in Argentina. This roundtable was part of UNITE’s and PAHO’s ongoing collaboration on digital health governance and health-related legislation in the Americas.","En septiembre de 2023, UNITE PAHO y el ""Observatorio de Salud de la Universidad de Buenos Aires"" coorganizaron una mesa redonda titulada ""El Futuro de la Agenda Parlamentaria sobre Salud Digital"". El evento tuvo como objetivo fomentar el diálogo sobre la transformación digital de la salud y explorar estrategias para construir mecanismos de gobernanza de salud digital efectivos en Argentina. Esta mesa redonda formó parte de la colaboración continua de UNITE y PAHO en la gobernanza de la salud digital y la legislación relacionada con la salud en las Américas.","- PAHO, through the participation of Dr. Marcelo D’Agostino, Unit Chief for Information Systems and Digital Health, provided key insights and evidence-based data on the regional digital health landscape.
- The roundtable provided a platform for parliamentarians and experts to engage in dialogue on digital health transformation models in Argentina, with a focus on advancing Universal Health Coverage (UHC).
- Participants discussed the potential creation of governance parameters to ensure security, privacy, interoperability, ethical use of data, equal access, and inclusion.
- Identified the main governance challenges and opportunities in Argentina and Latin America, and gathered expert suggestions for designing effective regulatory structures.
- Incorporated lessons learned and best practices into a set of recommendations for future elected officials.","- La OPS, a través de la participación del Dr. Marcelo D’ Agostino, Jefe de la Unidad de Sistemas de Información y Salud Digital, proporcionó información clave y datos basados en evidencia sobre el panorama de la salud digital en la región.
- La mesa redonda ofreció una plataforma para que parlamentarios y expertos participaran en un diálogo sobre modelos de transformación de la salud digital en Argentina, con un enfoque en avanzar hacia la Cobertura Universal de Salud (CUS).
- Los participantes discutieron la posible creación de parámetros de gobernanza para garantizar la seguridad, la privacidad, la interoperabilidad, el uso ético de los datos, el acceso equitativo y la inclusión.
- Se identificaron los principales desafíos y oportunidades de gobernanza en Argentina y América Latina, y se recopilaron sugerencias de expertos para diseñar estructuras regulatorias efectivas.
- Se incorporaron lecciones aprendidas y mejores prácticas en un conjunto de recomendaciones para futuros funcionarios electos."
NSA-2025-39-A_4,39,,NSA/ANE,"During the World Health Summit 2022, UNITE and WHO held an official session on “The Role of Parliamentarians in the Development of a Global Pandemic Treaty.” PAHO supported the participation of four parliamentarians from the Americas, bringing regional perspectives to discussions. PAHO’s involvement extended beyond facilitating participation, contributing to the integration of regional parliamentary perspectives from the Americas into global discussions on the pandemic agreement.","Durante la Cumbre Mundial de Salud 2022, UNITE y la OMS llevaron a cabo una sesión oficial sobre ""El Papel de los Parlamentarios en el Desarrollo de un Tratado Global sobre Pandemias"". La OPS apoyó la participación de cuatro parlamentarios de las Américas, aportando perspectivas regionales a las discusiones. La participación de la OPS se extendió más allá de facilitar la participación, contribuyendo a la integración de las perspectivas parlamentarias regionales de las Américas en las discusiones globales sobre el acuerdo pandémico.","- Increased parliamentarians' awareness of the importance of a global pandemic agreement.
- Emphasized opportunities for parliamentarians to participate in its discussions.","- Aumentó la conciencia de los parlamentarios sobre la importancia de un acuerdo global sobre pandemias.  
- Destacó las oportunidades para que los parlamentarios participen en sus discusiones."
NSA-2025-39-A_5,39,,NSA/ANE,"At the UNITE Global Summit 2022, UNITE, WHO, and UHC2030 organized a Regional Dialogue on Universal Health Coverage (UHC), involving parliamentarians in discussions about key political drivers, regional advancements, and the mobilization of domestic resources to promote UHC. The dialogue facilitated the sharing of best practices and aimed to raise awareness among parliamentarians about achieving UHC in every country.","En la Cumbre Global UNITE 2022, UNITE, la OMS y UHC2030 organizaron un Diálogo Regional sobre la UHC, involucrando a parlamentarios en discusiones sobre los principales impulsores políticos, el progreso regional y la movilización de recursos internos para avanzar en la UHC. El diálogo promovió el intercambio de mejores prácticas y la concienciación entre los parlamentarios sobre la consecución de la UHC en cada país.","The Summit concluded with the signing of a Declaration of Intent by the attending parliamentarians, which included a strong delegation of members from UNITE's Latin America and the Caribbean Chapter. The declaration endorsed a Health in All Policies approach and emphasized the importance of involving parliamentarians in negotiations for an international Pandemic Agreement. Furthermore, the declaration encouraged multilateralism and international cooperation to strengthen health systems and improve health financing—critical steps toward advancing sustainable health policies and achieving the UN Sustainable Development Goals (SDGs).","- La Cumbre concluyó con la firma de una Declaración de Intenciones por parte de los parlamentarios asistentes, que incluyó una fuerte delegación de miembros del Capítulo de América Latina y el Caribe de UNITE.  
- La declaración respaldó un enfoque de Salud en Todas las Políticas y enfatizó la importancia de involucrar a los parlamentarios en las negociaciones para un Acuerdo Internacional sobre Pandemias.  
- Además, la declaración fomentó el multilateralismo y la cooperación internacional para fortalecer los sistemas de salud y mejorar la financiación de la salud, pasos críticos para avanzar en políticas de salud sostenibles y alcanzar los Objetivos de Desarrollo Sostenible (ODS) de la ONU."
NSA-2025-39-A_6,39,,NSA/ANE,"In 2024, prior to the voting and adoption of the Pandemic Agreement proposal, UNITE launched a communication campaign titled ""Myth vs Reality."" The campaign included a series of questions and explanatory messages designed to clarify the content and negotiation process of the Agreement, as well as to address common myths and misinformation surrounding it.","En 2024, antes de la votación y adopción de la propuesta del Acuerdo sobre Pandemias, UNITE lanzó una campaña de comunicación titulada ""Mito vs Realidad"". La campaña presentó una serie de preguntas y mensajes explicativos destinados a aclarar el contenido y el proceso de negociación del Acuerdo, así como a abordar los mitos comunes y la desinformación que circula en torno a él.","- Enhanced parliamentarians’ knowledge of the Pandemic Agreement — its purpose, relevance to national and global health security, and the fact that its adoption does not compromise national sovereignty or grant WHO authority to impose lockdowns or mandatory vaccinations.  
- The campaign was disseminated through UNITE’s social media channels and later made available on a dedicated webpage, ensuring continued access for parliamentarians, partners, stakeholders, and the general public.","- Aumentar el conocimiento de los parlamentarios sobre el Acuerdo de Pandemia: su propósito, relevancia para la seguridad sanitaria nacional y global, y el hecho de que su adopción no compromete la soberanía nacional ni otorga a la OMS la autoridad para imponer confinamientos o vacunaciones obligatorias.  
- La campaña se difundió a través de los canales de redes sociales de UNITE y posteriormente se hizo disponible en una página web dedicada, asegurando el acceso continuo para parlamentarios, socios, partes interesadas y el público en general."
NSA-2025-39-A_7,39,,PAHO/OPS & NSA/ANE,"On July 4th, 2024, UNITE facilitated a high-level meeting between Dr. Jarbas Barbosa, PAHO Director, and Members of the Portuguese Parliament. The meeting took place at the Portuguese Parliament and provided an opportunity for direct dialogue on regional health priorities and the role of parliamentarians in advancing public health agendas.","El 4 de julio de 2024, UNITE facilitó una reunión de alto nivel entre el Dr. Jarbas Barbosa, Director de la OPS, y miembros del Parlamento Portugués. La reunión tuvo lugar en el Parlamento Portugués y brindó una oportunidad para un diálogo directo sobre las prioridades de salud regional y el papel de los parlamentarios en el avance de las agendas de salud pública.","Dr. Barbosa presented PAHO’s regional work and its collaboration with observer members, including Portugal, as a long-standing and valued partner. He also highlighted PAHO’s initiatives in Portuguese-speaking African countries and expressed the organization’s interest in strengthening its collaboration with the newly elected Parliamentary Health Commission.","- El Dr. Barbosa presentó el trabajo regional de la OPS y su colaboración con los miembros observadores, incluyendo a Portugal, como un socio valioso y de larga data.  
- También destacó las iniciativas de la OPS en los países africanos de habla portuguesa y expresó el interés de la organización en fortalecer su colaboración con la recién elegida Comisión de Salud del Parlamento."
NSA-2025-39-A_8,39,,NSA/ANE,"On April 4th and 5th, 2022, UNITE held a Regional Meeting in Buenos Aires, Argentina, bringing together members of its Latin America and the Caribbean Chapter to discuss strategies for pandemic preparedness and digital health to advance Universal Health Coverage (UHC). The event also featured the participation of representatives from PAHO, UNAIDS, the AIDS Healthcare Foundation (AHF), and the Coalition for Epidemic Preparedness Innovations (CEPI).","El 4 y 5 de abril de 2022, UNITE llevó a cabo una Reunión Regional en Buenos Aires, Argentina, reuniendo a miembros de su Capítulo de América Latina y el Caribe para discutir estrategias para la preparación ante pandemias y la salud digital con el fin de avanzar en la Cobertura Universal de Salud (CUS). El evento también contó con la participación de representantes de la OPS, ONUSIDA, la Fundación de Atención Médica del SIDA (AHF) y la Coalición para las Innovaciones en Preparación Epidémica (CEPI).","-The regional meeting, focused on strengthening the global health architecture for pandemic preparedness, provided a space for parliamentarians from different countries to share experiences and engage in dialogue.  
-PAHO was represented by Dr. Ignacio Ibarra, who shared the actions parliamentarians can actively take to support WHO in the region.  
-Parliamentarians learned and discussed UNITE's 2022 strategy and work plan for the region, and gained crucial tools to advocate for effective pandemic preparedness and Universal Health Coverage (UHC).  
-Discussions also addressed research and development (R&D) investment, the need for a pandemic treaty, and the importance of human rights and digital transformation in achieving the Sustainable Development Goals (SDGs).  
-The meeting concluded with the signing of the first regional declaration in support of a stronger global health architecture.  
-This contributed to consolidating sustained collaboration between PAHO and UNITE’s parliamentary network in the Americas, which has continued through subsequent regional and global initiatives.","- La reunión regional, centrada en fortalecer la arquitectura de salud global para la preparación ante pandemias, proporcionó un espacio para que los parlamentarios de diferentes países compartieran experiencias y participaran en un diálogo.
- La OPS estuvo representada por el Dr. Ignacio Ibarra, quien compartió las acciones que los parlamentarios pueden tomar activamente para apoyar a la OMS en la región.
- Los parlamentarios aprendieron y discutieron la estrategia y el plan de trabajo de UNITE para 2022 en la región, y obtuvieron herramientas cruciales para abogar por una preparación efectiva ante pandemias y la cobertura sanitaria universal (CSU).
- Las discusiones también abordaron la inversión en I+D, la necesidad de un tratado pandémico y la importancia de los derechos humanos y la transformación digital en la consecución de los ODS.
- La reunión concluyó con la firma de la primera declaración regional en apoyo a una arquitectura de salud global más sólida.
- Contribuyó a consolidar la colaboración sostenida entre la OPS y la red parlamentaria de UNITE en las Américas, que ha continuado a través de iniciativas regionales y globales posteriores."
